{
  "chapter": "CH01",
  "inputs_present": 28,
  "inputs_missing": [],
  "clusters": [
    {"cluster_id":"CH01-C001","file":"C:/SAP/sap-dev-academy/content/abap/CH01/CH01-L01.md","quote":"[[SAPGUI]]는 서버에 연결하는 데스크톱 클라이언트다.","category":"용어 충돌","severity":"높음","confidence":"확실","claim":"같은 레슨에서 '클라이언트'(SAPGUI 접속 프로그램)와 'Client'(테넌트·작업 공간)가 전혀 다른 뜻으로 충돌하는데 구분 안내가 없다.","conflict":false,"conflict_note":"","supporters":[{"agent":"AG03","model":"opus","seq":2},{"agent":"AG04","model":"opus","seq":1},{"agent":"AG03","model":"sonnet","seq":1},{"agent":"AG04","model":"sonnet","seq":2},{"agent":"AG03","model":"gemini-3.6-flash-high","seq":1}]},
    {"cluster_id":"CH01-C002","file":"C:/SAP/sap-dev-academy/content/abap/CH01/CH01-L02.md","quote":"`SE11`은 **ABAP Dictionary**다. 테이블·데이터 타입 같은","category":"흐름 절단·예고 과다","severity":"높음","confidence":"확실","claim":"첫 프로그램 생성 직전에 이번 챕터에서 안 쓰는 SE11·SE80이 전용 임베드까지 갖춘 섹션으로 끼어들어 최초 성공 경험의 흐름을 끊고 foreshadow 선언 수준을 초과한다.","conflict":false,"conflict_note":"","supporters":[{"agent":"AG03","model":"opus","seq":4},{"agent":"AG05","model":"opus","seq":1},{"agent":"AG05","model":"sonnet","seq":1},{"agent":"AG05","model":"sonnet","seq":2},{"agent":"AG05","model":"gpt-5.6-sol","seq":1},{"agent":"AG05","model":"gemini-3.6-flash-high","seq":1}]},
    {"cluster_id":"CH01-C003","file":"C:/SAP/sap-dev-academy/content/abap/CH01/CH01-L04.md","quote":"WRITE /: 'A', 'B'.    \" WRITE / 'A'. 그리고 WRITE / 'B'. → A, B가 각각 새 줄","category":"위젯 결함","severity":"높음","confidence":"확실","claim":"본문이 가르치는 `/:` 콜론 체인을 L04-S01 시뮬레이터가 파서 결함으로 거부하고 '변수 미선언'류의 엉뚱한 오류를 띄운다.","conflict":true,"conflict_note":"AG06-gemini(seq2, CH01-C027)는 반대로 `/:` 표기 자체가 비표준 문법이라고 주장 — 전제 상충. AG09-opus·AG09-sonnet은 overall에서 이 문법을 유효하다고 판정.","supporters":[{"agent":"AG02","model":"opus","seq":2},{"agent":"AG02","model":"gpt-5.6-sol","seq":2},{"agent":"AG02","model":"gemini-3.6-flash-high","seq":2}]},
    {"cluster_id":"CH01-C004","file":"C:/SAP/sap-dev-academy/content/abap/CH01/CH01-L05.md","quote":"DATA gv_qty TYPE n LENGTH 4 VALUE '0001'.","category":"과부하·선행 노출","severity":"높음","confidence":"추정","claim":"숫자·날짜 절이 미학습 개념(DATA·TYPE n/p·LENGTH·DECIMALS·VALUE·sy-datum)을 한꺼번에 노출하고 '[선행 사용]' 안내가 코드 뒤에 있어, 신규 항목 11종인 레슨의 인지 부하가 정점을 찍는다.","conflict":false,"conflict_note":"","supporters":[{"agent":"AG01","model":"opus","seq":9},{"agent":"AG01","model":"sonnet","seq":8},{"agent":"AG01","model":"gpt-5.6-sol","seq":1},{"agent":"AG05","model":"gpt-5.6-sol","seq":2},{"agent":"AG03","model":"gemini-3.6-flash-high","seq":4},{"agent":"AG05","model":"gemini-3.6-flash-high","seq":2}]},
    {"cluster_id":"CH01-C005","file":"C:/SAP/sap-dev-academy/content/abap/CH01/CH01-L05.md","quote":"금액은 내부적으로 소수 2자리(`100.00` = 숫자 `10000`)로 들고 있는데","category":"이해 불가 설명","severity":"높음","confidence":"확실","claim":"CURRENCY 콜아웃의 '100.00 = 10000' 내부 표현 설명이 중간 단계 없이 제시돼 입문자가 이해할 수 없고, '[선행 사용] 몰라도 됨' 면제와 '꼭 기억하자' 요구가 충돌하는 부하 스파이크다.","conflict":false,"conflict_note":"","supporters":[{"agent":"AG01","model":"opus","seq":10},{"agent":"AG05","model":"opus","seq":3},{"agent":"AG01","model":"gpt-5.6-sol","seq":2}]},
    {"cluster_id":"CH01-C006","file":"C:/SAP/sap-dev-academy/content/abap/CH01/CH01-L05.md","quote":"숫자와 날짜는 전용 옵션으로 더 깔끔하게 만든다. 아래는 **그대로 복사해 실행**해 보며","category":"체험 공백","severity":"높음","confidence":"확실","claim":"L05가 정식 도입하는 NO-ZERO·DECIMALS·CURRENCY·날짜 포맷(및 FORMAT 지속/RESET)을 페이지 유일 위젯 L05-S01이 전혀 지원하지 않아 코드는 있는데 체험이 없다(R2 위반).","conflict":false,"conflict_note":"","supporters":[{"agent":"AG02","model":"opus","seq":5},{"agent":"AG02","model":"sonnet","seq":4}]},
    {"cluster_id":"CH01-C007","file":"C:/SAP/sap-dev-academy/content/abap/CH01/CH01-L06.md","quote":"**다음 서버(품질·운영)로 전송**된다.","category":"사실 오류(프로세스)","severity":"높음","confidence":"확실","claim":"릴리스만으로 품질·운영 반영이 완료되는 것처럼 읽힌다 — 실제 반영은 대상 시스템의 별도 임포트이고 품질→운영 순차라 단계 구분이 필요하며, 같은 레슨 뒤의 임포트 서술과도 상충한다.","conflict":false,"conflict_note":"","supporters":[{"agent":"AG06","model":"opus","seq":6},{"agent":"AG01","model":"gpt-5.6-sol","seq":3},{"agent":"AG03","model":"gpt-5.6-sol","seq":4},{"agent":"AG06","model":"gpt-5.6-sol","seq":5}]},
    {"cluster_id":"CH01-C008","file":"C:/SAP/sap-dev-academy/content/abap/CH01/CH01-L07.md","quote":"**사용자가 내 프로그램에 접근하는 사실상 유일한 통로**다.","category":"사실 오류(과장)","severity":"높음","confidence":"확실","claim":"T-code를 '사실상 유일한 통로'로 단정한 것은 SA38·메뉴·배치·RFC·Fiori 등 다른 진입점을 간과한 과장이다.","conflict":false,"conflict_note":"","supporters":[{"agent":"AG06","model":"sonnet","seq":2},{"agent":"AG03","model":"gpt-5.6-sol","seq":5},{"agent":"AG06","model":"gpt-5.6-sol","seq":7}]},
    {"cluster_id":"CH01-C009","file":"C:/SAP/sap-dev-academy/content/abap/CH01/CH01-L07.md","quote":"이제 명령창에 `ZHELLO`만 쳐도 프로그램이 실행된다.","category":"위험한 생략(권한)","severity":"높음","confidence":"확실","claim":"T-code 생성 후 사용자 역할(PFCG)·S_TCODE 권한 반영이라는 필수 마지막 단계가 통째로 빠져 'T-code만 만들면 배포 끝'이라는 오해를 남긴다.","conflict":false,"conflict_note":"","supporters":[{"agent":"AG06","model":"opus","seq":8},{"agent":"AG06","model":"gpt-5.6-sol","seq":8}]},
    {"cluster_id":"CH01-C010","file":"C:/SAP/sap-dev-academy/embeds/abap/CH01-L02-S01.html","quote":"<code>$TMP</code>는 “내 PC 바탕화면” 같은 로컬 전용 보관소(이송·공유 불가)","category":"본문-위젯 불일치","severity":"높음","confidence":"확실","claim":"위젯이 안내 노트·저장 메시지 두 곳에서 $TMP를 '공유 불가'로 서술해, 본문(L02)과 L06이 명시적으로 교정하는 오개념('같은 서버 동료는 조회·실행 가능, 비공개 아님')을 반대로 가르친다.","conflict":false,"conflict_note":"","supporters":[{"agent":"AG02","model":"opus","seq":1},{"agent":"AG02","model":"sonnet","seq":2},{"agent":"AG02","model":"gpt-5.6-sol","seq":1},{"agent":"AG02","model":"gemini-3.6-flash-high","seq":1}]},
    {"cluster_id":"CH01-C011","file":"C:/SAP/sap-dev-academy/content/abap/CH01/_chapter.md","quote":"- 프로그램을 $TMP(Local)에 저장한 뒤, 개발 패키지와 이송요청의 필요를 이해한다.","category":"목표 커버리지 누락","severity":"중간","confidence":"확실","claim":"챕터 objectives·keywords가 마지막 레슨 L07(SE93 T-code 생성)을 전혀 덮지 않아 챕터의 약속과 실제 구성이 어긋난다.","conflict":false,"conflict_note":"","supporters":[{"agent":"AG01","model":"opus","seq":13},{"agent":"AG05","model":"opus","seq":5}]},
    {"cluster_id":"CH01-C012","file":"C:/SAP/sap-dev-academy/content/abap/CH01/CH01-L01.md","quote":"Client 100과 200은 데이터가 서로 보이지 않는 별개의 방이다.","category":"위험한 생략(사실 정밀도)","severity":"중간","confidence":"확실","claim":"Client가 가르는 것은 client 종속 업무 데이터뿐인데 완전 격리처럼 단정해, 프로그램 등 Repository 객체·client 독립 설정은 모든 client가 공유한다는 단서가 빠졌다.","conflict":false,"conflict_note":"","supporters":[{"agent":"AG06","model":"opus","seq":1},{"agent":"AG03","model":"gpt-5.6-sol","seq":1},{"agent":"AG06","model":"gpt-5.6-sol","seq":1}]},
    {"cluster_id":"CH01-C013","file":"C:/SAP/sap-dev-academy/content/abap/CH01/CH01-L01.md","quote":"- **Application Server / Instance** — 어느 서버에 붙을지","category":"용어 풀이 누락","severity":"중간","confidence":"확실","claim":"'Instance'가 아무 풀이 없이 Application Server와 한 항목으로 묶여 등장해 두 용어가 같은 것인지 다른 것인지 알 수 없다.","conflict":false,"conflict_note":"","supporters":[{"agent":"AG01","model":"opus","seq":1},{"agent":"AG01","model":"sonnet","seq":1},{"agent":"AG04","model":"gpt-5.6-sol","seq":2}]},
    {"cluster_id":"CH01-C014","file":"C:/SAP/sap-dev-academy/content/abap/CH01/CH01-L01.md","quote":"## SAP GUI와 접속 구조","category":"표기 일관성","severity":"중간","confidence":"확실","claim":"제품명이 이 소제목에서만 'SAP GUI'(띄어쓰기)로 쓰여 파일·챕터 전체의 'SAPGUI' 표기와 갈린다.","conflict":false,"conflict_note":"","supporters":[{"agent":"AG04","model":"opus","seq":2},{"agent":"AG04","model":"sonnet","seq":1},{"agent":"AG04","model":"gpt-5.6-sol","seq":1}]},
    {"cluster_id":"CH01-C015","file":"C:/SAP/sap-dev-academy/content/abap/CH01/CH01-L02.md","quote":"아래 첫 화면에서 보듯, **Database table·View·Data type·Domain·Search help** 같은 사전","category":"용어 과부하","severity":"중간","confidence":"확실","claim":"SE11 절에서 처음 보는 용어 5개(Database table·View·Data type·Domain·Search help)가 한 문장에 개별 풀이 없이 쏟아진다.","conflict":false,"conflict_note":"","supporters":[{"agent":"AG01","model":"opus","seq":2},{"agent":"AG04","model":"gpt-5.6-sol","seq":3}]},
    {"cluster_id":"CH01-C016","file":"C:/SAP/sap-dev-academy/content/abap/CH01/CH01-L02.md","quote":"Database table·View·Data type·Domain·Search help 같은 사전 오브젝트를 골라 만든다.","category":"직역 어색","severity":"중간","confidence":"확실","claim":"'사전 오브젝트'는 ABAP Dictionary의 어색한 직역이라 국어/영어 사전류 기능으로 오인될 소지가 있다.","conflict":false,"conflict_note":"","supporters":[{"agent":"AG04","model":"gemini-3.6-flash-high","seq":2}]},
    {"cluster_id":"CH01-C017","file":"C:/SAP/sap-dev-academy/content/abap/CH01/CH01-L02.md","quote":"introduces: [\"T-code\", \"명령창 접두어(/n·/o)\", \"SE38(ABAP Editor)\", \"Z/Y 네임스페이스\"","category":"신규 개념 과다","severity":"중간","confidence":"추정","claim":"L02가 introduces 6종에 SE11·SE80까지 실질 8～9개 신규 개념을 안은 챕터 최중량 레슨인데 정리(요약) 장치가 없어 축약 또는 두 레슨 분할 검토가 필요하다.","conflict":false,"conflict_note":"","supporters":[{"agent":"AG05","model":"opus","seq":2},{"agent":"AG01","model":"sonnet","seq":5},{"agent":"AG05","model":"sonnet","seq":3}]},
    {"cluster_id":"CH01-C018","file":"C:/SAP/sap-dev-academy/content/abap/CH01/CH01-L02.md","quote":"3. 속성 화면에서 **Type = Executable Program**(실행형)을 고르고 저장.","category":"절차 생략","severity":"중간","confidence":"추정","claim":"속성 화면 단계가 Type 하나만 안내해 실제 화면에서 채워야 하는 나머지 칸(Title 등)을 알 수 없어 따라 하다 멈출 수 있다.","conflict":false,"conflict_note":"","supporters":[{"agent":"AG01","model":"opus","seq":3}]},
    {"cluster_id":"CH01-C019","file":"C:/SAP/sap-dev-academy/content/abap/CH01/CH01-L02.md","quote":"[[$TMP]]라는 **로컬 전용 패키지**에 들어가고, 이송요청 없이 바로 저장된다.","category":"용어 첫 등장 풀이 누락","severity":"중간","confidence":"확실","claim":"'패키지'·'이송요청'이 풀이 없이 먼저 등장하고 정식 도입은 4개 레슨 뒤(L06)라, 그때까지 뜻을 모른 채 읽어야 한다.","conflict":false,"conflict_note":"","supporters":[{"agent":"AG01","model":"sonnet","seq":4},{"agent":"AG04","model":"opus","seq":5},{"agent":"AG04","model":"sonnet","seq":3}]},